{
  "$schema": "http://json-schema.org/draft-07/schema#",
  "$id": "https://github.com/openwallet-foundation/credential-format-comparison-sig/tree/main/viewer/viewer/src/schemas/Trust-Management.json",
  "type": "object",
  "additionalProperties": false,
  "properties": {
    "$schema": {
      "type": "string",
      "description": "JSON Schema URI"
    },
    "Trust Management": {
      "type": "string",
      "description": "Glossary"
    },
    "Implementation Support (e.g. Libraries) / Active Community": {
      "$ref": "defs.json#/definitions/Implementation-Support"
    },
    "IPR Policy": {
      "$ref": "defs.json#/definitions/IPR-Policy"
    },
    "Standardization (Body, Process)": {
      "$ref": "defs.json#/definitions/Standardization"
    },
    "Specification": {
      "$ref": "defs.json#/definitions/Specification"
    },
    "Description": {
      "type": "string",
      "description": "Explanation how this trust management approach works"
    }
  },
  "required": ["$schema", "Trust Management"],
  "title": "TrustManagement"
}
