{
  "$schema": "./schema.json",
  "Trust Management": "X.509 certificates",
  "Implementation Support (e.g. Libraries) / Active Community": "broadly available",
  "IPR Policy": "tbd",
  "Standardization (Body, Process)": "tbd",
  "Specification": "tbd",
  "Description": "Trust is managed by way of attributes attested in the certificate (e.g. could be role of an issuer) in combination with trust chains. The ultimate entity in the chain is typically trust anchor recipients need to rely in. "
}
